{
  "$schema": "https://json-schema.org/draft/2020-12/schema",
  "$id": "https://specs.getwololo.dev/eval-result/eval-run.schema.json",
  "schemaVersion": 1,
  "title": "eval-run",
  "description": "One evaluation run over an eval-candidate (04-wololo-evals SPEC Section 3.2): an aggregate over n_trials trials per arm. status transitions are one-way (queued -> running -> {passed, failed, errored}), enforced at the persistence layer. composite_score is frozen exactly once at completion and is the ONLY composite consumers read; a re-score is a NEW run. suite_version and rubric_version are content hashes pinned at run creation (SPEC Section 9); comparisons never mix rubric versions.",
  "type": "object",
  "properties": {
    "schemaVersion": { "const": 1 },
    "tenant_id": { "type": "string", "minLength": 1 },
    "run_id": { "type": "string", "minLength": 1 },
    "candidate_id": { "type": "string", "minLength": 1 },
    "eval_suite": { "enum": ["skill-review", "task-uplift", "repo-eval", "regression-replay"] },
    "status": { "enum": ["queued", "running", "passed", "failed", "errored"] },
    "suite_version": { "type": "string", "pattern": "^[0-9a-f]{64}$" },
    "rubric_version": { "type": "string", "pattern": "^[0-9a-f]{64}$" },
    "n_trials": { "type": "integer", "minimum": 1 },
    "started_at": {
      "type": "string",
      "pattern": "^\\d{4}-\\d{2}-\\d{2}T\\d{2}:\\d{2}:\\d{2}(\\.\\d+)?(Z|[+-]\\d{2}:\\d{2})$",
      "format": "date-time"
    },
    "completed_at": {
      "type": "string",
      "pattern": "^\\d{4}-\\d{2}-\\d{2}T\\d{2}:\\d{2}:\\d{2}(\\.\\d+)?(Z|[+-]\\d{2}:\\d{2})$",
      "format": "date-time"
    },
    "composite_score": { "type": "number", "minimum": 0 },
    "verdict_stats": {
      "type": "object",
      "properties": {
        "mean": { "type": "number" },
        "stddev": { "type": "number", "minimum": 0 },
        "ci_low": { "type": "number" },
        "ci_high": { "type": "number" },
        "wins": { "type": "integer", "minimum": 0 },
        "losses": { "type": "integer", "minimum": 0 },
        "n": { "type": "integer", "minimum": 1 },
        "low_confidence": { "type": "boolean" }
      },
      "required": ["mean", "stddev", "ci_low", "ci_high", "wins", "losses", "n", "low_confidence"],
      "additionalProperties": false
    },
    "eval_log_prefix": { "type": "string", "minLength": 1 }
  },
  "required": [
    "schemaVersion",
    "tenant_id",
    "run_id",
    "candidate_id",
    "eval_suite",
    "status",
    "suite_version",
    "rubric_version",
    "n_trials"
  ],
  "additionalProperties": false
}
